#clustering method	cluster number	cluster color	gene count	protein name	protein identifier	protein description
MCL	37	Aquamarine 10	4	CTNND1	9606.ENSP00000382004	Catenin delta-1; Binds to and inhibits the transcriptional repressor ZBTB33, which may lead to activation of target genes of the Wnt signaling pathway (By similarity). Associates with and regulates the cell adhesion properties of both C-, E- and N-cadherins, being critical for their surface stability. Implicated both in cell transformation by SRC and in ligand-induced receptor signaling through the EGF, PDGF, CSF-1 and ERBB2 receptors. Promotes GLIS2 C-terminal cleavage; Belongs to the beta-catenin family
MCL	38	Aquamarine 8	4	GUSB	9606.ENSP00000302728	Beta-glucuronidase; Plays an important role in the degradation of dermatan and keratan sulfates; Belongs to the glycosyl hydrolase 2 family
MCL	38	Aquamarine 8	4	IDUA	9606.ENSP00000247933	Alpha-L-iduronidase; Iduronidase, alpha-L-
MCL	38	Aquamarine 8	4	SGSH	9606.ENSP00000314606	N-sulphoglucosamine sulphohydrolase; Catalyzes a step in lysosomal heparan sulfate degradation; Belongs to the sulfatase family
MCL	38	Aquamarine 8	4	SUMF2	9606.ENSP00000341938	Sulfatase-modifying factor 2; Lacks formyl-glycine generating activity and is unable to convert newly synthesized inactive sulfatases to their active form. Inhibits the activation of sulfatases by SUMF1
MCL	39	Aquamarine 6	3	ANXA6	9606.ENSP00000346550	Annexin A6; May associate with CD21. May regulate the release of Ca(2+) from intracellular stores; Annexins
MCL	39	Aquamarine 6	3	EGFR	9606.ENSP00000275493	Epidermal growth factor receptor; Receptor tyrosine kinase binding ligands of the EGF family and activating several signaling cascades to convert extracellular cues into appropriate cellular responses. Known ligands include EGF, TGFA/TGF-alpha, amphiregulin, epigen/EPGN, BTC/betacellulin, epiregulin/EREG and HBEGF/heparin-binding EGF. Ligand binding triggers receptor homo- and/or heterodimerization and autophosphorylation on key cytoplasmic residues. The phosphorylated receptor recruits adapter proteins like GRB2 which in turn activates complex downstream signaling cascades. Activates  [...] 
MCL	39	Aquamarine 6	3	SH3BGRL	9606.ENSP00000362308	SH3 domain-binding glutamic acid-rich-like protein; SH3 domain binding glutamate rich protein like
MCL	40	Aquamarine 4	3	PRKACB	9606.ENSP00000359719	cAMP-dependent protein kinase catalytic subunit beta; Mediates cAMP-dependent signaling triggered by receptor binding to GPCRs. PKA activation regulates diverse cellular processes such as cell proliferation, the cell cycle, differentiation and regulation of microtubule dynamics, chromatin condensation and decondensation, nuclear envelope disassembly and reassembly, as well as regulation of intracellular transport mechanisms and ion flux. Regulates the abundance of compartmentalized pools of its regulatory subunits through phosphorylation of PJA2 which binds and ubiquitinates these subu [...] 
MCL	40	Aquamarine 4	3	PRKAR1A	9606.ENSP00000376475	cAMP-dependent protein kinase type I-alpha regulatory subunit; Regulatory subunit of the cAMP-dependent protein kinases involved in cAMP signaling in cells
MCL	40	Aquamarine 4	3	PRKAR2B	9606.ENSP00000265717	cAMP-dependent protein kinase type II-beta regulatory subunit; Regulatory subunit of the cAMP-dependent protein kinases involved in cAMP signaling in cells. Type II regulatory chains mediate membrane association by binding to anchoring proteins, including the MAP2 kinase
MCL	41	Aquamarine 2	3	PPP1R7	9606.ENSP00000234038	Protein phosphatase 1 regulatory subunit 7; Regulatory subunit of protein phosphatase 1; Belongs to the SDS22 family
MCL	41	Aquamarine 2	3	PPP2CB	9606.ENSP00000221138	Serine/threonine-protein phosphatase 2A catalytic subunit beta isoform; PP2A can modulate the activity of phosphorylase B kinase casein kinase 2, mitogen-stimulated S6 kinase, and MAP-2 kinase; Protein phosphatase catalytic subunits
MCL	41	Aquamarine 2	3	VCP	9606.ENSP00000351777	Transitional endoplasmic reticulum ATPase; Necessary for the fragmentation of Golgi stacks during mitosis and for their reassembly after mitosis. Involved in the formation of the transitional endoplasmic reticulum (tER). The transfer of membranes from the endoplasmic reticulum to the Golgi apparatus occurs via 50-70 nm transition vesicles which derive from part-rough, part-smooth transitional elements of the endoplasmic reticulum (tER). Vesicle budding from the tER is an ATP-dependent process. The ternary complex containing UFD1, VCP and NPLOC4 binds ubiquitinated proteins and is neces [...] 
MCL	42	Cyan	3	AGT	9606.ENSP00000355627	Angiotensinogen; Essential component of the renin-angiotensin system (RAS), a potent regulator of blood pressure, body fluid and electrolyte homeostasis; Endogenous ligands
MCL	42	Cyan	3	F2	9606.ENSP00000308541	Prothrombin; Thrombin, which cleaves bonds after Arg and Lys, converts fibrinogen to fibrin and activates factors V, VII, VIII, XIII, and, in complex with thrombomodulin, protein C. Functions in blood homeostasis, inflammation and wound healing; Belongs to the peptidase S1 family
MCL	42	Cyan	3	SERPINB6	9606.ENSP00000484343	Serpin B6; May be involved in the regulation of serine proteinases present in the brain or extravasated from the blood (By similarity). Inhibitor of cathepsin G, kallikrein-8 and thrombin. May play an important role in the inner ear in the protection against leakage of lysosomal content during stress and loss of this protection results in cell death and sensorineural hearing loss; Deafness associated genes
MCL	43	Aquamarine	3	ANXA2	9606.ENSP00000346032	Annexin A2; Calcium-regulated membrane-binding protein whose affinity for calcium is greatly enhanced by anionic phospholipids. It binds two calcium ions with high affinity. May be involved in heat-stress response. Inhibits PCSK9-enhanced LDLR degradation, probably reduces PCSK9 protein levels via a translational mechanism but also competes with LDLR for binding with PCSK9; Belongs to the annexin family
MCL	43	Aquamarine	3	S100A10	9606.ENSP00000357801	Protein S100-A10; Because S100A10 induces the dimerization of ANXA2/p36, it may function as a regulator of protein phosphorylation in that the ANXA2 monomer is the preferred target (in vitro) of tyrosine- specific kinase; Belongs to the S-100 family
MCL	43	Aquamarine	3	S100A11	9606.ENSP00000271638	Protein S100-A11; Facilitates the differentiation and the cornification of keratinocytes; Belongs to the S-100 family
MCL	44	Aquamarine 3	3	HSD17B12	9606.ENSP00000278353	Very-long-chain 3-oxoacyl-CoA reductase; Catalyzes the second of the four reactions of the long- chain fatty acids elongation cycle. This endoplasmic reticulum- bound enzymatic process, allows the addition of two carbons to the chain of long- and very long-chain fatty acids/VLCFAs per cycle. This enzyme has a 3-ketoacyl-CoA reductase activity, reducing 3- ketoacyl-CoA to 3-hydroxyacyl-CoA, within each cycle of fatty acid elongation. Thereby, it may participate in the production of VLCFAs of different chain lengths that are involved in multiple biological processes as precursors of memb [...] 
MCL	44	Aquamarine 3	3	SCD5	9606.ENSP00000316329	Stearoyl-coa desaturase (delta-9 desaturase); Stearoyl-CoA desaturase 5; Stearyl-CoA desaturase that utilizes O(2) and electrons from reduced cytochrome b5 to introduce the first double bond into saturated fatty acyl-CoA substrates. Catalyzes the insertion of a cis double bond at the delta-9 position into fatty acyl-CoA substrates including palmitoyl-CoA and stearoyl-CoA. Gives rise to a mixture of 16:1 and 18:1 unsaturated fatty acids
MCL	44	Aquamarine 3	3	TECR	9606.ENSP00000215567	Very-long-chain enoyl-CoA reductase; Catalyzes the last of the four reactions of the long- chain fatty acids elongation cycle. This endoplasmic reticulum- bound enzymatic process, allows the addition of 2 carbons to the chain of long- and very long-chain fatty acids/VLCFAs per cycle. This enzyme reduces the trans-2,3-enoyl-CoA fatty acid intermediate to an acyl-CoA that can be further elongated by entering a new cycle of elongation. Thereby, it participates in the production of VLCFAs of different chain lengths that are involved in multiple biological processes as precursors of membran [...] 
MCL	45	Aquamarine 5	3	CAPG	9606.ENSP00000263867	Macrophage-capping protein; Calcium-sensitive protein which reversibly blocks the barbed ends of actin filaments but does not sever preformed actin filaments. May play an important role in macrophage function. May play a role in regulating cytoplasmic and/or nuclear structures through potential interactions with actin. May bind DNA; Gelsolin/villins
MCL	45	Aquamarine 5	3	CAPZA2	9606.ENSP00000354947	Capping actin protein of muscle z-line alpha subunit 2; F-actin-capping protein subunit alpha-2; F-actin-capping proteins bind in a Ca(2+)-independent manner to the fast growing ends of actin filaments (barbed end) thereby blocking the exchange of subunits at these ends. Unlike other capping proteins (such as gelsolin and severin), these proteins do not sever actin filaments
MCL	45	Aquamarine 5	3	DCTN2	9606.ENSP00000408910	Dynactin subunit 2; Modulates cytoplasmic dynein binding to an organelle, and plays a role in prometaphase chromosome alignment and spindle organization during mitosis. Involved in anchoring microtubules to centrosomes. May play a role in synapse formation during brain development; Dynactin
MCL	46	Aquamarine 7	3	DDAH2	9606.ENSP00000364945	N(G),N(G)-dimethylarginine dimethylaminohydrolase 2; Hydrolyzes N(G),N(G)-dimethyl-L-arginine (ADMA) and N(G)-monomethyl-L-arginine (MMA) which act as inhibitors of NOS. Has therefore a role in the regulation of nitric oxide generation
MCL	46	Aquamarine 7	3	EPB41L2	9606.ENSP00000338481	Band 4.1-like protein 2; Required for dynein-dynactin complex and NUMA1 recruitment at the mitotic cell cortex during anaphase; Erythrocyte membrane protein band 4.1
MCL	46	Aquamarine 7	3	EPB41L3	9606.ENSP00000343158	Band 4.1-like protein 3; Tumor suppressor that inhibits cell proliferation and promotes apoptosis. Modulates the activity of protein arginine N- methyltransferases, including PRMT3 and PRMT5; Erythrocyte membrane protein band 4.1
MCL	47	Aquamarine 9	3	AKAP12	9606.ENSP00000384537	A-kinase anchor protein 12; Anchoring protein that mediates the subcellular compartmentation of protein kinase A (PKA) and protein kinase C (PKC); A-kinase anchoring proteins
MCL	47	Aquamarine 9	3	PEA15	9606.ENSP00000357055	Astrocytic phosphoprotein PEA-15; Blocks Ras-mediated inhibition of integrin activation and modulates the ERK MAP kinase cascade. Inhibits RPS6KA3 activities by retaining it in the cytoplasm (By similarity). Inhibits both TNFRSF6- and TNFRSF1A-mediated CASP8 activity and apoptosis. Regulates glucose transport by controlling both the content of SLC2A1 glucose transporters on the plasma membrane and the insulin-dependent trafficking of SLC2A4 from the cell interior to the surface; Death effector domain containing
MCL	47	Aquamarine 9	3	PRKCA	9606.ENSP00000408695	Protein kinase C alpha type; Calcium-activated, phospholipid- and diacylglycerol (DAG)-dependent serine/threonine-protein kinase that is involved in positive and negative regulation of cell proliferation, apoptosis, differentiation, migration and adhesion, tumorigenesis, cardiac hypertrophy, angiogenesis, platelet function and inflammation, by directly phosphorylating targets such as RAF1, BCL2, CSPG4, TNNT2/CTNT, or activating signaling cascade involving MAPK1/3 (ERK1/2) and RAP1GAP. Involved in cell proliferation and cell growth arrest by positive and negative regulation of the cell  [...] 
MCL	48	Aquamarine 11	3	ANP32E	9606.ENSP00000463154	Acidic leucine-rich nuclear phosphoprotein 32 family member E; Histone chaperone that specifically mediates the genome- wide removal of histone H2A.Z/H2AFZ from the nucleosome: removes H2A.Z/H2AFZ from its normal sites of deposition, especially from enhancer and insulator regions. Not involved in deposition of H2A.Z/H2AFZ in the nucleosome. May stabilize the evicted H2A.Z/H2AFZ-H2B dimer, thus shifting the equilibrium towards dissociation and the off-chromatin state. Inhibits activity of protein phosphatase 2A (PP2A). Does not inhibit protein phosphatase 1. May play a role in cerebella [...] 
MCL	48	Aquamarine 11	3	NPM1	9606.ENSP00000296930	Nucleophosmin; Involved in diverse cellular processes such as ribosome biogenesis, centrosome duplication, protein chaperoning, histone assembly, cell proliferation, and regulation of tumor suppressors p53/TP53 and ARF. Binds ribosome presumably to drive ribosome nuclear export. Associated with nucleolar ribonucleoprotein structures and bind single-stranded nucleic acids. Acts as a chaperonin for the core histones H3, H2B and H4. Stimulates APEX1 endonuclease activity on apurinic/apyrimidinic (AP) double- stranded DNA but inhibits APEX1 endonuclease activity on AP single-stranded RNA.  [...] 
MCL	48	Aquamarine 11	3	SETSIP	9606.ENSP00000480946	Template-activating factor i; Protein SETSIP; Plays a role as a transcriptional activator involved in the early stage of somatic cell reprogramming. Promotes the differentiation of protein-induced pluripotent stem (PiPS) cells into endothelial cells and the formation of vascular-like tubes (in vitro). Involved in the transcription induction of vascular endothelial-cadherin (VE-cadherin) expression. Associates to the VE-cadherin gene promoter
MCL	49	Sky Blue 12	3	FTH1	9606.ENSP00000273550	Ferritin heavy chain; Stores iron in a soluble, non-toxic, readily available form. Important for iron homeostasis. Has ferroxidase activity. Iron is taken up in the ferrous form and deposited as ferric hydroxides after oxidation. Also plays a role in delivery of iron to cells. Mediates iron uptake in capsule cells of the developing kidney (By similarity); Belongs to the ferritin family
MCL	49	Sky Blue 12	3	FTL	9606.ENSP00000366525	Ferritin light chain; Stores iron in a soluble, non-toxic, readily available form. Important for iron homeostasis. Iron is taken up in the ferrous form and deposited as ferric hydroxides after oxidation. Also plays a role in delivery of iron to cells. Mediates iron uptake in capsule cells of the developing kidney (By similarity); Belongs to the ferritin family
MCL	49	Sky Blue 12	3	HP1BP3	9606.ENSP00000312625	Heterochromatin protein 1-binding protein 3; Component of heterochromatin that maintains heterochromatin integrity during G1/S progression and regulates the duration of G1 phase to critically influence cell proliferative capacity. Mediates chromatin condensation during hypoxia, leading to increased tumor cell viability, radio-resistance, chemo-resistance and self- renewal
MCL	50	Sky Blue 10	3	CBR1	9606.ENSP00000290349	Carbonyl reductase [NADPH] 1; NADPH-dependent reductase with broad substrate specificity. Catalyzes the reduction of a wide variety of carbonyl compounds including quinones, prostaglandins, menadione, plus various xenobiotics. Catalyzes the reduction of the antitumor anthracyclines doxorubicin and daunorubicin to the cardiotoxic compounds doxorubicinol and daunorubicinol. Can convert prostaglandin E2 to prostaglandin F2-alpha. Can bind glutathione, which explains its higher affinity for glutathione-conjugated substrates. Catalyzes the reduction of S-nitrosoglutathione; Short chain dehy [...] 
MCL	50	Sky Blue 10	3	FAM49B	9606.ENSP00000429150	Protein FAM49B; Family with sequence similarity 49 member B
MCL	50	Sky Blue 10	3	PTGES3	9606.ENSP00000482075	Cytosolic prostaglandin-e synthase; Prostaglandin E synthase 3; Cytosolic prostaglandin synthase that catalyzes the oxidoreduction of prostaglandin endoperoxide H2 (PGH2) to prostaglandin E2 (PGE2). Molecular chaperone that localizes to genomic response elements in a hormone-dependent manner and disrupts receptor-mediated transcriptional activation, by promoting disassembly of transcriptional regulatory complexes. Facilitates HIF alpha proteins hydroxylation via interaction with EGLN1/PHD2, leading to recruit EGLN1/PHD2 to the HSP90 pathway
MCL	51	Sky Blue 8	3	GBA	9606.ENSP00000314508	Glucosylceramidase that catalyzes, within the lysosomal compartment, the hydrolysis of glucosylceramide/GlcCer into free ceramide and glucose . Thereby, plays a central role in the degradation of complex lipids and the turnover of cellular membranes . Through the production of ceramides, participates to the PKC-activated salvage pathway of ceramide formation . Also plays a role in cholesterol metabolism . May either catalyze the glucosylation of cholesterol, through a transglucosylation reaction that transfers glucose from glucosylceramide to cholesterol . The short chain saturated C8: [...] 
MCL	51	Sky Blue 8	3	GCA	9606.ENSP00000394842	Grancalcin; Calcium-binding protein that may play a role in the adhesion of neutrophils to fibronectin. May play a role in the formation of focal adhesions; EF-hand domain containing
MCL	51	Sky Blue 8	3	SCAMP3	9606.ENSP00000307275	Secretory carrier-associated membrane protein 3; Functions in post-Golgi recycling pathways. Acts as a recycling carrier to the cell surface; Belongs to the SCAMP family
MCL	52	Sky Blue 6	3	CALU	9606.ENSP00000438248	Calumenin; Involved in regulation of vitamin K-dependent carboxylation of multiple N-terminal glutamate residues. Seems to inhibit gamma-carboxylase GGCX. Binds 7 calcium ions with a low affinity (By similarity); Belongs to the CREC family
MCL	52	Sky Blue 6	3	CDK5RAP3	9606.ENSP00000438886	CDK5 regulatory subunit-associated protein 3; Probable tumor suppressor initially identified as a CDK5R1 interactor controlling cell proliferation. Negatively regulates NF-kappa-B-mediated gene transcription through the control of RELA phosphorylation. Also regulates mitotic G2/M transition checkpoint and mitotic G2 DNA damage checkpoint. Through its interaction with CDKN2A/ARF and MDM2 may induce MDM2-dependent p53/TP53 ubiquitination, stabilization and activation in the nucleus, thereby promoting G1 cell cycle arrest and inhibition of cell proliferation. May play a role in the unfold [...] 
MCL	52	Sky Blue 6	3	NUCB2	9606.ENSP00000436455	Nucleobindin-2; Calcium-binding protein. May have a role in calcium homeostasis; EF-hand domain containing
MCL	53	Sky Blue 4	2	CALM2	9606.ENSP00000272298	Calmodulin 2 (phosphorylase kinase, delta); EF-hand domain containing
MCL	53	Sky Blue 4	2	HRAS	9606.ENSP00000407586	GTPase HRas; Involved in the activation of Ras protein signal transduction. Ras proteins bind GDP/GTP and possess intrinsic GTPase activity; Belongs to the small GTPase superfamily. Ras family
MCL	54	Sky Blue 2	2	CD163	9606.ENSP00000352071	Scavenger receptor cysteine-rich type 1 protein M130; Acute phase-regulated receptor involved in clearance and endocytosis of hemoglobin/haptoglobin complexes by macrophages and may thereby protect tissues from free hemoglobin-mediated oxidative damage. May play a role in the uptake and recycling of iron, via endocytosis of hemoglobin/haptoglobin and subsequent breakdown of heme. Binds hemoglobin/haptoglobin complexes in a calcium-dependent and pH-dependent manner. Exhibits a higher affinity for complexes of hemoglobin and multimeric haptoglobin of HP*1F phenotype than for complexes of [...] 
MCL	54	Sky Blue 2	2	STAB1	9606.ENSP00000312946	Stabilin-1; Acts as a scavenger receptor for acetylated low density lipoprotein. Binds to both Gram-positive and Gram-negative bacteria and may play a role in defense against bacterial infection. When inhibited in endothelial tube formation assays, there is a marked decrease in cell-cell interactions, suggesting a role in angiogenesis. Involved in the delivery of newly synthesized CHID1/SI-CLP from the biosynthetic compartment to the endosomal/lysosomal system
MCL	55	Sky Blue	2	HBB	9606.ENSP00000333994	Hemoglobin subunit beta; Involved in oxygen transport from the lung to the various peripheral tissues; Belongs to the globin family
MCL	55	Sky Blue	2	HBD	9606.ENSP00000369654	Hemoglobin subunit delta; Involved in oxygen transport from the lung to the various peripheral tissues; Belongs to the globin family
MCL	56	Sky Blue 3	2	AP2A1	9606.ENSP00000351926	AP-2 complex subunit alpha-1; Component of the adaptor protein complex 2 (AP-2). Adaptor protein complexes function in protein transport via transport vesicles in different membrane traffic pathways. Adaptor protein complexes are vesicle coat components and appear to be involved in cargo selection and vesicle formation. AP-2 is involved in clathrin-dependent endocytosis in which cargo proteins are incorporated into vesicles surrounded by clathrin (clathrin- coated vesicles, CCVs) which are destined for fusion with the early endosome. The clathrin lattice serves as a mechanical scaffold [...] 
MCL	56	Sky Blue 3	2	CLTC	9606.ENSP00000479606	Clathrin heavy chain 1; Clathrin is the major protein of the polyhedral coat of coated pits and vesicles. Two different adapter protein complexes link the clathrin lattice either to the plasma membrane or to the trans-Golgi network. Acts as component of the TACC3/ch- TOG/clathrin complex proposed to contribute to stabilization of kinetochore fibers of the mitotic spindle by acting as inter- microtubule bridge. The TACC3/ch-TOG/clathrin complex is required for the maintenance of kinetochore fiber tension. Plays a role in early autophagosome formation; Belongs to the clathrin heavy chain [...] 
MCL	57	Sky Blue 5	2	MIF	9606.ENSP00000215754	Macrophage migration inhibitory factor; Pro-inflammatory cytokine. Involved in the innate immune response to bacterial pathogens. The expression of MIF at sites of inflammation suggests a role as mediator in regulating the function of macrophages in host defense. Counteracts the anti- inflammatory activity of glucocorticoids. Has phenylpyruvate tautomerase and dopachrome tautomerase activity (in vitro), but the physiological substrate is not known. It is not clear whether the tautomerase activity has any physiological relevance, and whether it is important for cytokine activity
MCL	57	Sky Blue 5	2	PCMT1	9606.ENSP00000356354	Protein-L-isoaspartate(D-aspartate) O-methyltransferase; Catalyzes the methyl esterification of L-isoaspartyl and D-aspartyl residues in peptides and proteins that result from spontaneous decomposition of normal L-aspartyl and L-asparaginyl residues. It plays a role in the repair and/or degradation of damaged proteins. Acts on EIF4EBP2, microtubule-associated protein 2, calreticulin, clathrin light chains a and b, Ubiquitin carboxyl-terminal hydrolase isozyme L1, phosphatidylethanolamine- binding protein 1, stathmin, beta-synuclein and alpha-synuclein; Seven-beta-strand methyltransfera [...] 
MCL	58	Sky Blue 7	2	CD44	9606.ENSP00000398632	CD44 antigen; Receptor for hyaluronic acid (HA). Mediates cell-cell and cell-matrix interactions through its affinity for HA, and possibly also through its affinity for other ligands such as osteopontin, collagens, and matrix metalloproteinases (MMPs). Adhesion with HA plays an important role in cell migration, tumor growth and progression. In cancer cells, may play an important role in invadopodia formation. Also involved in lymphocyte activation, recirculation and homing, and in hematopoiesis. Altered expression or dysfunction causes numerous pathogenic phenotypes. Great protein hete [...] 
MCL	58	Sky Blue 7	2	GLG1	9606.ENSP00000205061	Golgi apparatus protein 1; Binds fibroblast growth factor and E-selectin (cell- adhesion lectin on endothelial cells mediating the binding of neutrophils)
MCL	59	Sky Blue 9	2	NCSTN	9606.ENSP00000294785	Nicastrin; Essential subunit of the gamma-secretase complex, an endoprotease complex that catalyzes the intramembrane cleavage of integral membrane proteins such as Notch receptors and APP (amyloid-beta precursor protein). The gamma- secretase complex plays a role in Notch and Wnt signaling cascades and regulation of downstream processes via its role in processing key regulatory proteins, and by regulating cytosolic CTNNB1 levels
MCL	59	Sky Blue 9	2	NOMO2	9606.ENSP00000477502	Nodal modulator 2; May antagonize Nodal signaling and subsequent organization of axial structures during mesodermal patterning, via its interaction with NCLN
MCL	60	Sky Blue 11	2	ENDOD1	9606.ENSP00000278505	Endonuclease domain-containing 1 protein; May act as a DNase and a RNase
MCL	60	Sky Blue 11	2	SOD1	9606.ENSP00000270142	Superoxide dismutase, cu-zn family; Superoxide dismutase [Cu-Zn]; Destroys radicals which are normally produced within the cells and which are toxic to biological systems
MCL	61	Cornflower Blue 9	2	EZR	9606.ENSP00000356042	Villin 2 (ezrin); Ezrin; Probably involved in connections of major cytoskeletal structures to the plasma membrane. In epithelial cells, required for the formation of microvilli and membrane ruffles on the apical pole. Along with PLEKHG6, required for normal macropinocytosis; A-kinase anchoring proteins
MCL	61	Cornflower Blue 9	2	SLC9A3R1	9606.ENSP00000262613	Na(+)/H(+) exchange regulatory cofactor NHE-RF1; Scaffold protein that connects plasma membrane proteins with members of the ezrin/moesin/radixin family and thereby helps to link them to the actin cytoskeleton and to regulate their surface expression. Necessary for recycling of internalized ADRB2. Was first known to play a role in the regulation of the activity and subcellular location of SLC9A3. Necessary for cAMP-mediated phosphorylation and inhibition of SLC9A3. May enhance Wnt signaling. May participate in HTR4 targeting to microvilli (By similarity). Involved in the regulation of  [...] 
MCL	62	Cornflower Blue 8	2	CPQ	9606.ENSP00000220763	Carboxypeptidase Q; Carboxypeptidase that may play an important role in the hydrolysis of circulating peptides. Catalyzes the hydrolysis of dipeptides with unsubstituted terminals into amino acids. May play a role in the liberation of thyroxine hormone from its thyroglobulin (Tg) precursor
