#clustering method	cluster number	cluster color	gene count	protein name	protein identifier	protein description
MCL	9	Fire Brick 3	15	KCTD12	9606.ENSP00000366694	Potassium channel tetramerization domain containing 12; BTB/POZ domain-containing protein KCTD12; Auxiliary subunit of GABA-B receptors that determine the pharmacology and kinetics of the receptor response. Increases agonist potency and markedly alter the G-protein signaling of the receptors by accelerating onset and promoting desensitization (By similarity)
MCL	9	Fire Brick 3	15	SLC12A9	9606.ENSP00000275730	Solute carrier family 12 member 9; May be an inhibitor of SLC12A1. Seems to correspond to a subunit of a multimeric transport system and thus, additional subunits may be required for its function; Solute carriers
MCL	10	Brown	13	CCT3	9606.ENSP00000295688	T-complex protein 1 subunit gamma; Molecular chaperone; assists the folding of proteins upon ATP hydrolysis. As part of the BBS/CCT complex may play a role in the assembly of BBSome, a complex involved in ciliogenesis regulating transports vesicles to the cilia. Known to play a role, in vitro, in the folding of actin and tubulin; Chaperonins
MCL	10	Brown	13	CRYAB	9606.ENSP00000433560	Alpha-crystallin B chain; May contribute to the transparency and refractive index of the lens. Has chaperone-like activity, preventing aggregation of various proteins under a wide range of stress conditions; Small heat shock proteins
MCL	10	Brown	13	GGH	9606.ENSP00000260118	Gamma-glutamyl hydrolase; Hydrolyzes the polyglutamate sidechains of pteroylpolyglutamates. Progressively removes gamma-glutamyl residues from pteroylpoly-gamma-glutamate to yield pteroyl-alpha- glutamate (folic acid) and free glutamate. May play an important role in the bioavailability of dietary pteroylpolyglutamates and in the metabolism of pteroylpolyglutamates and antifolates; Belongs to the peptidase C26 family
MCL	10	Brown	13	HNRNPR	9606.ENSP00000363745	Heterogeneous nuclear ribonucleoprotein R; Component of ribonucleosomes, which are complexes of at least 20 other different heterogenious nuclear ribonucleoproteins (hnRNP). hnRNP play an important role in processing of precursor mRNA in the nucleus; RNA binding motif containing
MCL	10	Brown	13	HSP90AA1	9606.ENSP00000335153	Heat shock protein HSP 90-alpha; Molecular chaperone that promotes the maturation, structural maintenance and proper regulation of specific target proteins involved for instance in cell cycle control and signal transduction. Undergoes a functional cycle that is linked to its ATPase activity which is essential for its chaperone activity. This cycle probably induces conformational changes in the client proteins, thereby causing their activation. Interacts dynamically with various co-chaperones that modulate its substrate recognition, ATPase cycle and chaperone function. Engages with a ra [...] 
MCL	10	Brown	13	HSP90AB1	9606.ENSP00000360609	Heat shock protein 90 alpha family class b member 1; Heat shock protein HSP 90-beta; Molecular chaperone that promotes the maturation, structural maintenance and proper regulation of specific target proteins involved for instance in cell cycle control and signal transduction. Undergoes a functional cycle that is linked to its ATPase activity. This cycle probably induces conformational changes in the client proteins, thereby causing their activation. Interacts dynamically with various co-chaperones that modulate its substrate recognition, ATPase cycle and chaperone function. Engages wit [...] 
MCL	10	Brown	13	HSPA12A	9606.ENSP00000358211	Heat shock protein family A member 12A
MCL	10	Brown	13	HSPA1B	9606.ENSP00000364801	Heat shock protein family A member 1B
MCL	10	Brown	13	HSPA2	9606.ENSP00000378199	Heat shock-related 70 kDa protein 2; Molecular chaperone implicated in a wide variety of cellular processes, including protection of the proteome from stress, folding and transport of newly synthesized polypeptides, activation of proteolysis of misfolded proteins and the formation and dissociation of protein complexes. Plays a pivotal role in the protein quality control system, ensuring the correct folding of proteins, the re-folding of misfolded proteins and controlling the targeting of proteins for subsequent degradation. This is achieved through cycles of ATP binding, ATP hydrolysis [...] 
MCL	10	Brown	13	HSPA9	9606.ENSP00000297185	Stress-70 protein, mitochondrial; Chaperone protein which plays an important role in mitochondrial iron-sulfur cluster (ISC) biogenesis. Interacts with and stabilizes ISC cluster assembly proteins FXN, NFU1, NFS1 and ISCU. Regulates erythropoiesis via stabilization of ISC assembly. May play a role in the control of cell proliferation and cellular aging (By similarity); Belongs to the heat shock protein 70 family
MCL	10	Brown	13	HSPB1	9606.ENSP00000248553	Heat shock protein family b (small) member 1; Heat shock protein beta-1; Small heat shock protein which functions as a molecular chaperone probably maintaining denatured proteins in a folding- competent state. Plays a role in stress resistance and actin organization. Through its molecular chaperone activity may regulate numerous biological processes including the phosphorylation and the axonal transport of neurofilament proteins
MCL	10	Brown	13	S100A1	9606.ENSP00000292169	Protein S100-A1; Probably acts as a Ca(2+) signal transducer. In response to an increase in intracellular Ca(2+) levels, binds calcium which triggers a conformational change. This conformational change allows interaction of S1001A with specific target proteins, such as TPR- containing proteins, and the modulation of their activity; Belongs to the S-100 family
MCL	10	Brown	13	UBA1	9606.ENSP00000338413	Ubiquitin-like modifier-activating enzyme 1; Catalyzes the first step in ubiquitin conjugation to mark cellular proteins for degradation through the ubiquitin- proteasome system. Activates ubiquitin by first adenylating its C-terminal glycine residue with ATP, and thereafter linking this residue to the side chain of a cysteine residue in E1, yielding a ubiquitin-E1 thioester and free AMP. Essential for the formation of radiation- induced foci, timely DNA repair and for response to replication stress. Promotes the recruitment of TP53BP1 and BRCA1 at DNA damage sites
MCL	11	Light Green 20	10	ATP6AP1	9606.ENSP00000358777	V-type proton ATPase subunit S1; Accessory subunit of the proton-transporting vacuolar (V)-ATPase protein pump, which is required for luminal acidification of secretory vesicles. Guides the V-type ATPase into specialized subcellular compartments, such as neuroendocrine regulated secretory vesicles or the ruffled border of the osteoclast, thereby regulating its activity. Involved in membrane trafficking and Ca(2+)-dependent membrane fusion. May play a role in the assembly of the V-type ATPase complex. In aerobic conditions, involved in intracellular iron homeostasis, thus triggering the [...] 
MCL	11	Light Green 20	10	ATP6V0A1	9606.ENSP00000264649	V-type proton ATPase 116 kDa subunit a isoform 1; Required for assembly and activity of the vacuolar ATPase. Potential role in differential targeting and regulation of the enzyme for a specific organelle (By similarity); V-type ATPases
MCL	11	Light Green 20	10	ATP6V0D1	9606.ENSP00000290949	V-type proton ATPase subunit d 1; Subunit of the integral membrane V0 complex of vacuolar ATPase. Vacuolar ATPase is responsible for acidifying a variety of intracellular compartments in eukaryotic cells, thus providing most of the energy required for transport processes in the vacuolar system. May play a role in coupling of proton transport and ATP hydrolysis (By similarity). May play a role in cilium biogenesis through regulation of the transport and the localization of proteins to the cilium (By similarity). In aerobic conditions, involved in intracellular iron homeostasis, thus tri [...] 
MCL	11	Light Green 20	10	ATP6V1A	9606.ENSP00000273398	V-type proton ATPase catalytic subunit A; Catalytic subunit of the peripheral V1 complex of vacuolar ATPase. V-ATPase vacuolar ATPase is responsible for acidifying a variety of intracellular compartments in eukaryotic cells. In aerobic conditions, involved in intracellular iron homeostasis, thus triggering the activity of Fe(2+) prolyl hydroxylase (PHD) enzymes, and leading to HIF1A hydroxylation and subsequent proteasomal degradation; Belongs to the ATPase alpha/beta chains family
MCL	11	Light Green 20	10	ATP6V1B2	9606.ENSP00000276390	V-type proton ATPase subunit B, brain isoform; Non-catalytic subunit of the peripheral V1 complex of vacuolar ATPase. V-ATPase is responsible for acidifying a variety of intracellular compartments in eukaryotic cells; Belongs to the ATPase alpha/beta chains family
MCL	11	Light Green 20	10	ATP6V1E1	9606.ENSP00000253413	V-type proton ATPase subunit E 1; Subunit of the peripheral V1 complex of vacuolar ATPase essential for assembly or catalytic function. V-ATPase is responsible for acidifying a variety of intracellular compartments in eukaryotic cells; V-type ATPases
MCL	11	Light Green 20	10	LAMTOR1	9606.ENSP00000278671	Late endosomal/lysosomal adaptor, mapk and mtor activator 1; Ragulator complex protein LAMTOR1; As part of the Ragulator complex it is involved in amino acid sensing and activation of mTORC1, a signaling complex promoting cell growth in response to growth factors, energy levels, and amino acids. Activated by amino acids through a mechanism involving the lysosomal V-ATPase, the Ragulator functions as a guanine nucleotide exchange factor activating the small GTPases Rag. Activated Ragulator and Rag GTPases function as a scaffold recruiting mTORC1 to lysosomes where it is in turn activate [...] 
MCL	11	Light Green 20	10	LAMTOR2	9606.ENSP00000357288	Ragulator complex protein LAMTOR2; As part of the Ragulator complex it is involved in amino acid sensing and activation of mTORC1, a signaling complex promoting cell growth in response to growth factors, energy levels, and amino acids. Activated by amino acids through a mechanism involving the lysosomal V-ATPase, the Ragulator functions as a guanine nucleotide exchange factor activating the small GTPases Rag. Activated Ragulator and Rag GTPases function as a scaffold recruiting mTORC1 to lysosomes where it is in turn activated. Adapter protein that enhances the efficiency of the MAP ki [...] 
MCL	11	Light Green 20	10	LAMTOR3	9606.ENSP00000424183	Late endosomal/lysosomal adaptor, mapk and mtor activator 3; Ragulator complex protein LAMTOR3; As part of the Ragulator complex it is involved in amino acid sensing and activation of mTORC1, a signaling complex promoting cell growth in response to growth factors, energy levels, and amino acids. Activated by amino acids through a mechanism involving the lysosomal V-ATPase, the Ragulator functions as a guanine nucleotide exchange factor activating the small GTPases Rag. Activated Ragulator and Rag GTPases function as a scaffold recruiting mTORC1 to lysosomes where it is in turn activate [...] 
MCL	11	Light Green 20	10	LAMTOR5	9606.ENSP00000256644	Ragulator complex protein LAMTOR5; As part of the Ragulator complex it is involved in amino acid sensing and activation of mTORC1, a signaling complex promoting cell growth in response to growth factors, energy levels, and amino acids. Activated by amino acids through a mechanism involving the lysosomal V-ATPase, the Ragulator functions as a guanine nucleotide exchange factor activating the small GTPases Rag. Activated Ragulator and Rag GTPases function as a scaffold recruiting mTORC1 to lysosomes where it is in turn activated. When complexed to BIRC5, interferes with apoptosome assemb [...] 
MCL	12	Light Green 15	9	APMAP	9606.ENSP00000217456	Adipocyte plasma membrane-associated protein; Exhibits strong arylesterase activity with beta-naphthyl acetate and phenyl acetate. May play a role in adipocyte differentiation; Belongs to the strictosidine synthase family
MCL	12	Light Green 15	9	ARL6IP5	9606.ENSP00000273258	Adp ribosylation factor like gtpase 6 interacting protein 5; PRA1 family protein 3; Regulates intracellular concentrations of taurine and glutamate. Negatively modulates SLC1A1/EAAC1 glutamate transport activity by decreasing its affinity for glutamate in a PKC activity-dependent manner. May be involved in membrane traffic; YIP family
MCL	12	Light Green 15	9	ATL1	9606.ENSP00000351155	Atlastin-1; GTPase tethering membranes through formation of trans- homooligomers and mediating homotypic fusion of endoplasmic reticulum membranes. Functions in endoplasmic reticulum tubular network biogenesis. May also regulate Golgi biogenesis. May regulate axonal development; Belongs to the TRAFAC class dynamin-like GTPase superfamily. GB1/RHD3-type GTPase family. GB1 subfamily
MCL	12	Light Green 15	9	ATL3	9606.ENSP00000381844	Atlastin-3; GTPase tethering membranes through formation of trans- homooligomers and mediating homotypic fusion of endoplasmic reticulum membranes. Functions in endoplasmic reticulum tubular network biogenesis
MCL	12	Light Green 15	9	CKAP4	9606.ENSP00000367265	Cytoskeleton-associated protein 4; High-affinity epithelial cell surface receptor for APF
MCL	12	Light Green 15	9	PRAF2	9606.ENSP00000451962	PRA1 family protein 2; May be involved in ER/Golgi transport and vesicular traffic. Plays a proapoptic role in cerulenin-induced neuroblastoma apoptosis; YIP family
MCL	12	Light Green 15	9	RTN1	9606.ENSP00000267484	Reticulon-1; May be involved in neuroendocrine secretion or in membrane trafficking in neuroendocrine cells
MCL	12	Light Green 15	9	RTN4	9606.ENSP00000337838	Reticulon-4; Developmental neurite growth regulatory factor with a role as a negative regulator of axon-axon adhesion and growth, and as a facilitator of neurite branching. Regulates neurite fasciculation, branching and extension in the developing nervous system. Involved in down-regulation of growth, stabilization of wiring and restriction of plasticity in the adult CNS. Regulates the radial migration of cortical neurons via an RTN4R-LINGO1 containing receptor complex (By similarity). Isoform 2 reduces the anti-apoptotic activity of Bcl-xl and Bcl-2. This is likely consecutive to thei [...] 
MCL	12	Light Green 15	9	TMEM33	9606.ENSP00000422473	Transmembrane protein 33; Acts as a regulator of the tubular endoplasmic reticulum (ER) network. Suppresses the RTN3/4-induced formation of the ER tubules. Positively regulates PERK-mediated and IRE1-mediated unfolded protein response signaling
MCL	13	Light Green 11	9	CPNE3	9606.ENSP00000477590	Copine-3; Calcium-dependent phospholipid-binding protein that plays a role in ERBB2-mediated tumor cell migration in response to growth factor heregulin stimulation; Belongs to the copine family
MCL	13	Light Green 11	9	GDI1	9606.ENSP00000394071	Rab GDP dissociation inhibitor alpha; Regulates the GDP/GTP exchange reaction of most Rab proteins by inhibiting the dissociation of GDP from them, and the subsequent binding of GTP to them. Promotes the dissociation of GDP-bound Rab proteins from the membrane and inhibits their activation. Promotes the dissociation of RAB1A, RAB3A, RAB5A and RAB10 from membranes
MCL	13	Light Green 11	9	GDI2	9606.ENSP00000369538	Rab GDP dissociation inhibitor beta; Regulates the GDP/GTP exchange reaction of most Rab proteins by inhibiting the dissociation of GDP from them, and the subsequent binding of GTP to them
MCL	13	Light Green 11	9	PLIN3	9606.ENSP00000221957	Perilipin-3; Required for the transport of mannose 6-phosphate receptors (MPR) from endosomes to the trans-Golgi network; Perilipins
MCL	13	Light Green 11	9	RAB11B	9606.ENSP00000333547	Ras-related protein Rab-11B; The small GTPases Rab are key regulators of intracellular membrane trafficking, from the formation of transport vesicles to their fusion with membranes. Rabs cycle between an inactive GDP-bound form and an active GTP-bound form that is able to recruit to membranes different set of downstream effectors directly responsible for vesicle formation, movement, tethering and fusion. That Rab plays a role in endocytic recycling, regulating apical recycling of several transmembrane proteins including cystic fibrosis transmembrane conductance regulator/CFTR, epitheli [...] 
MCL	13	Light Green 11	9	RAB14	9606.ENSP00000362946	Ras-related protein Rab-14; Involved in membrane trafficking between the Golgi complex and endosomes during early embryonic development. Regulates the Golgi to endosome transport of FGFR-containing vesicles during early development, a key process for developing basement membrane and epiblast and primitive endoderm lineages during early postimplantation development. May act by modulating the kinesin KIF16B-cargo association to endosomes (By similarity). Regulates, together with its guanine nucleotide exchange factor DENND6A, the specific endocytic transport of ADAM10, N- cadherin/CDH2 s [...] 
MCL	13	Light Green 11	9	RAB21	9606.ENSP00000261263	Ras-related protein Rab-21; Regulates integrin internalization and recycling, but does not influence the traffic of endosomally translocated receptors in general. As a result, may regulate cell adhesion and migration (By similarity). During the mitosis of adherent cells, controls the endosomal trafficking of integrins which is required for the successful completion of cytokinesis. Involved in neurite growth (By similarity); RAB, member RAS oncogene GTPases
MCL	13	Light Green 11	9	RAB31	9606.ENSP00000461945	RAB31, member RAS oncogene family; Ras-related protein Rab-31; The small GTPases Rab are key regulators of intracellular membrane trafficking, from the formation of transport vesicles to their fusion with membranes. Rabs cycle between an inactive GDP-bound form and an active GTP-bound form that is able to recruit to membranes different set of downstream effectors directly responsible for vesicle formation, movement, tethering and fusion. Required for the integrity and for normal function of the Golgi apparatus and the trans-Golgi network. Plays a role in insulin-stimulated translocatio [...] 
MCL	13	Light Green 11	9	VPS45	9606.ENSP00000358126	Vacuolar protein sorting-associated protein 45; May play a role in vesicle-mediated protein trafficking from the Golgi stack through the trans-Golgi network
MCL	14	Light Green 8	9	CAST	9606.ENSP00000379157	Calpastatin; Specific inhibition of calpain (calcium-dependent cysteine protease). Plays a key role in postmortem tenderization of meat and have been proposed to be involved in muscle protein degradation in living tissue; Belongs to the protease inhibitor I27 (calpastatin) family
MCL	14	Light Green 8	9	ICAM5	9606.ENSP00000221980	Intercellular adhesion molecule 5; ICAM proteins are ligands for the leukocyte adhesion protein LFA-1 (integrin alpha-L/beta-2); Ig-like cell adhesion molecule family
MCL	14	Light Green 8	9	ITGA2	9606.ENSP00000296585	Integrin alpha-2; Integrin alpha-2/beta-1 is a receptor for laminin, collagen, collagen C-propeptides, fibronectin and E-cadherin. It recognizes the proline-hydroxylated sequence G-F-P-G-E-R in collagen. It is responsible for adhesion of platelets and other cells to collagens, modulation of collagen and collagenase gene expression, force generation and organization of newly synthesized extracellular matrix; CD molecules
MCL	14	Light Green 8	9	ITGA6	9606.ENSP00000386896	Integrin subunit alpha 6; Integrin alpha-6; Integrin alpha-6/beta-1 is a receptor for laminin on platelets. Integrin alpha-6/beta-4 is a receptor for laminin in epithelial cells and it plays a critical structural role in the hemidesmosome (By similarity). ITGA6:ITGB4 binds to NRG1 (via EGF domain) and this binding is essential for NRG1-ERBB signaling. ITGA6:ITGB4 binds to IGF1 and this binding is essential for IGF1 signaling
MCL	14	Light Green 8	9	ITGAV	9606.ENSP00000261023	Integrin alpha-V; The alpha-V (ITGAV) integrins are receptors for vitronectin, cytotactin, fibronectin, fibrinogen, laminin, matrix metalloproteinase-2, osteopontin, osteomodulin, prothrombin, thrombospondin and vWF. They recognize the sequence R-G-D in a wide array of ligands. ITGAV:ITGB3 binds to fractalkine (CX3CL1) and may act as its coreceptor in CX3CR1-dependent fractalkine signaling. ITGAV:ITGB3 binds to NRG1 (via EGF domain) and this binding is essential for NRG1-ERBB signaling. ITGAV:ITGB3 binds to FGF1 and this binding is essential for FGF1 signaling. ITGAV:ITGB3 binds to IGF [...] 
MCL	14	Light Green 8	9	ITGB1	9606.ENSP00000379350	Integrin beta-1; Integrins alpha-1/beta-1, alpha-2/beta-1, alpha-10/beta- 1 and alpha-11/beta-1 are receptors for collagen. Integrins alpha- 1/beta-1 and alpha-2/beta-2 recognize the proline-hydroxylated sequence G-F-P-G-E-R in collagen. Integrins alpha-2/beta-1, alpha- 3/beta-1, alpha-4/beta-1, alpha-5/beta-1, alpha-8/beta-1, alpha- 10/beta-1, alpha-11/beta-1 and alpha-V/beta-1 are receptors for fibronectin. Alpha-4/beta-1 recognizes one or more domains within the alternatively spliced CS-1 and CS-5 regions of fibronectin. Integrin alpha-5/beta-1 is a receptor for fibrinogen. Integrin [...] 
MCL	14	Light Green 8	9	ITGB2	9606.ENSP00000380948	Integrin beta-2; Integrin ITGAL/ITGB2 is a receptor for ICAM1, ICAM2, ICAM3 and ICAM4. Integrins ITGAM/ITGB2 and ITGAX/ITGB2 are receptors for the iC3b fragment of the third complement component and for fibrinogen. Integrin ITGAX/ITGB2 recognizes the sequence G-P-R in fibrinogen alpha-chain. Integrin ITGAM/ITGB2 recognizes P1 and P2 peptides of fibrinogen gamma chain. Integrin ITGAM/ITGB2 is also a receptor for factor X. Integrin ITGAD/ITGB2 is a receptor for ICAM3 and VCAM1. Contributes to natural killer cell cytotoxicity. Involved in leukocyte adhesion and transmigration of leukocyte [...] 
MCL	14	Light Green 8	9	ITGB8	9606.ENSP00000222573	Integrin subunit beta 8; Integrin beta-8; Integrin alpha-V/beta-8 is a receptor for fibronectin
MCL	14	Light Green 8	9	LAMC1	9606.ENSP00000258341	Laminin subunit gamma-1; Binding to cells via a high affinity receptor, laminin is thought to mediate the attachment, migration and organization of cells into tissues during embryonic development by interacting with other extracellular matrix components
MCL	15	Light Green 4	9	H1F0	9606.ENSP00000344504	H1 histone family member 0; Histone H1.0; Histones H1 are necessary for the condensation of nucleosome chains into higher-order structures. The H1F0 histones are found in cells that are in terminal stages of differentiation or that have low rates of cell division
MCL	15	Light Green 4	9	H2AFX	9606.ENSP00000434024	H2A histone family member X; Histone H2AX; Variant histone H2A which replaces conventional H2A in a subset of nucleosomes. Nucleosomes wrap and compact DNA into chromatin, limiting DNA accessibility to the cellular machineries which require DNA as a template. Histones thereby play a central role in transcription regulation, DNA repair, DNA replication and chromosomal stability. DNA accessibility is regulated via a complex set of post-translational modifications of histones, also called histone code, and nucleosome remodeling. Required for checkpoint-mediated arrest of cell cycle progre [...] 
MCL	15	Light Green 4	9	HIST1H2BA	9606.ENSP00000274764	Histone cluster 1 h2b family member a; Histone H2B type 1-A; Variant histone specifically required to direct the transformation of dissociating nucleosomes to protamine in male germ cells (By similarity). Entirely replaces classical histone H2B prior nucleosome to protamine transition and probably acts as a nucleosome dissociating factor that creates a more dynamic chromatin, facilitating the large-scale exchange of histones (By similarity). Core component of nucleosome (By similarity). Nucleosomes wrap and compact DNA into chromatin, limiting DNA accessibility to the cellular machiner [...] 
MCL	15	Light Green 4	9	HIST1H4F	9606.ENSP00000244537	Histone cluster 1 H4 family member f; Core component of nucleosome. Nucleosomes wrap and compact DNA into chromatin, limiting DNA accessibility to the cellular machineries which require DNA as a template. Histones thereby play a central role in transcription regulation, DNA repair, DNA replication and chromosomal stability. DNA accessibility is regulated via a complex set of post-translational modifications of histones, also called histone code, and nucleosome remodeling (By similarity)
MCL	15	Light Green 4	9	NAP1L1	9606.ENSP00000477538	Nucleosome assembly protein 1-like 1; May be involved in modulating chromatin formation and contribute to regulation of cell proliferation; Belongs to the nucleosome assembly protein (NAP) family
MCL	15	Light Green 4	9	NASP	9606.ENSP00000255120	Nuclear autoantigenic sperm protein; Required for DNA replication, normal cell cycle progression and cell proliferation. Forms a cytoplasmic complex with HSP90 and H1 linker histones and stimulates HSP90 ATPase activity. NASP and H1 histone are subsequently released from the complex and translocate to the nucleus where the histone is released for binding to DNA
MCL	15	Light Green 4	9	SSRP1	9606.ENSP00000278412	Structure-specific recognition protein 1; FACT complex subunit SSRP1; Component of the FACT complex, a general chromatin factor that acts to reorganize nucleosomes. The FACT complex is involved in multiple processes that require DNA as a template such as mRNA elongation, DNA replication and DNA repair. During transcription elongation the FACT complex acts as a histone chaperone that both destabilizes and restores nucleosomal structure. It facilitates the passage of RNA polymerase II and transcription by promoting the dissociation of one histone H2A-H2B dimer from the nucleosome, then s [...] 
